tweet_id,tweet_text,user,timestamp,extracted_awards
290620657170014208,Why did I just flip out? Because one of the best people in the world showed up on the tv..Kristen Wiig #goldenglobes !,mo_JOE_marino,2013-01-13 18:45:38,Best
290620657170014208,Why did I just flip out? Because one of the best people in the world showed up on the tv..Kristen Wiig #goldenglobes !,mo_JOE_marino,2013-01-13 18:45:38,Best People In The World Showed Up On The Tv
290620662043779072,"Seacrest asked what Ben Affleck's kids wrote on his hands.  Best use of ""I'd tell you but I'd have to kill you."" #GoldenGlobes #redcarpet",StaceyWOMC,2013-01-13 18:45:39,Best
290620661959888896,"RT @Loki_Page: #GoldenGlobes Times! We wish good luck tonight to Rachel Weisz, nominated for Best Actress. ""The Deep Blue Sea""",QueenF1989,2013-01-13 18:45:39,Best
290620661959888896,"RT @Loki_Page: #GoldenGlobes Times! We wish good luck tonight to Rachel Weisz, nominated for Best Actress. ""The Deep Blue Sea""",QueenF1989,2013-01-13 18:45:39,Best Actress
